{
  "version": "2.0.0",
  "project": {
    "name": "Test Project",
    "vision": "A test project for validation",
    "projectType": "cli-tool"
  },
  "problemSpace": {
    "primaryProblem": {
      "title": "Test Problem",
      "description": "Test problem description",
      "impact": "high"
    }
  },
  "solutionSpace": {
    "overview": "Test solution overview",
    "capabilities": [
      {
        "name": "Test Capability",
        "description": "Test capability description"
      }
    ]
  },
  "architectureDiagrams": [
    {
      "title": "New System Flow",
      "mermaidCode": "graph TB\n  A[Start]\n  B[End]\n  A-->B"
    }
  ]
}